link,inclusion order,title,qualifies,authors,publication,doi,year,,keywords,institution of first author,institution of last author,author associated with proximate data provider,proximate data source,country of study,spatial extent of study,start year,end year,,methodology development or analysis,individual species question,community question,,response variable – species richness,response variable – diversity,response variable – distribution,response variable – abundance,response variable – phenology,,trends over time,alien species focus,taxonomic group,,data structure – organized data collection scheme,data structure – sampling effort known,data structure – non-detection,data structure – multiple datasets integrated for analysis,,data type – what where when only,data type – abundance,data type – visit specific covariates,data type – life stage,data type – photo,data type – audio,data type – video,data type – voucher of some kind necessary for analysis,data type – gridded,grid resolution,,results type – inference,results type – prediction,results type – descriptive only,,biological records as response variable,biological records as predictor variable,biological records in facilitative role but not analyzed,spatially uneven sampling corrected for,prediction performance measure,cross validation,testing using simulation,testing using training data,testing using data subset,testing using independent dataset,,analysis method,predictor variables,methodology focus,,coding DONE,other notes,eligible for meta-analysis
https://www.scopus.com/inward/record.uri?eid=2-s2.0-85045742312&partnerID=40&md5=67af25067cd77b7515df08e199fe5344,249,Inferring status changes of three widespread British reptiles from NBN Atlas records,TRUE,"Beebee, TJC; Ratcliffe, S",The Herpetological Bulletin,NA,2018,,NA,Amphibian and Reptile Conservation Trust,National Biodiversity Network,T,NBN Atlas,UK,Great Britain,1970,2017,,F,T,F,,F,F,F,F,F,,T,F,reptile,,F,F,F,F,,T,F,F,F,F,F,F,F,T,1 km^2,,T,F,F,,T,F,F,F,NA,F,F,T,F,F,,linear regression,time; land use,NA,,T,,T
http://etheses.whiterose.ac.uk/id/eprint/18904,789,Using citizen science data to reveal the role of ecological processes in range changes of grasshoppers and crickets in Britain,TRUE (but there is also an article from this),NA,NA,NA,2017,,,,,,,,,,,,,,,,,,,,,,,,,,,,,,,,,,,,,,,,,,,,,,,,,,,,,,,,,,,,,,,
http://journals.plos.org/plosone/article?id=10.1371/journal.pone.0130488,2220,Two species with an unusual combination of traits dominate responses of British grasshoppers and crickets to environmental change,TRUE (but also a PhD thesis of which this is a chapter qualifies),NA,NA,NA,2015,,,,,,,,,,,,,,,,,,,,,,,,,,,,,,,,,,,,,,,,,,,,,,,,,,,,,,,,,,,,,,,
https://search.proquest.com/docview/2002427411?accountid=14507,3,The sensitivity of breeding songbirds to changes in seasonal timing is linked to population change but cannot be directly attributed to the effects of trophic asynchrony on productivity,TRUE,"Franks, SE; Pearce-Higgins, JW; Atkinson, S; Bell, JR; Botham, MS; Brereton, TM; Harrington, R; Leech, DI",Global Change Biology,10.1111/gcb.13960,2017,,citizen science; climate change; demography; migration; mismatch hypothesis; phenology; population change; trophic asynchrony,British Trust for Ornithology,British Trust for Ornithology,T,British Trust for Ornithology,UK,UK,1983,2010,,F,T,F,,F,F,F,T,T,,T,F,birds; plants; moths; aphids; butterflies,,T,F,T,T,,T,F,F,T,F,F,F,F,F,NA,,T,F,F,,T,F,F,F,NA,F,F,T,F,F,,GLM,time; migration strategy; year; precipitation; temperature ,NA,,T,,T
https://link.springer.com/article/10.1007/s10531-017-1479-5,7,Essential biodiversity variables are not global,TRUE,"Peterson, AT; Soberon, J",Biodiversity and Conservation,10.1007/s10531-017-1479-5,2018,,essential biodiversity variables; ecosystem services; genetic composition; populations; traits; community composition; primary biodiversity data,The University of Kansas,The University of Kansas,F,GBIF; Compadre; Commadre,global,global,unclear,unclear,,F,F,F,,F,F,F,F,F,,F,F,all,,T,T,T,T,,T,F,F,F,F,F,F,F,F,NA,,F,F,T,,T,F,F,F,NA,F,F,F,F,F,,description; maps,country,NA,,T,,F
https://www.sciencedirect.com/science/article/pii/S0006320717308030,38,Missing native oyster (Ostrea edulis L.) beds in a European Marine Protected Area: Should there be widespread restorative management?,TRUE,"Farinas-Franco, JM; Pearce, B; Mair, JM; Harries, DB; MacPherson, RC; Porter, JS; Reimer, PJ; Sanderson, WG",Biological Conservation,10.1016/j.biocon.2018.03.010,2018,,oyster; Ostrea edulis; conservation management; MPA; baseline; restoration,"Heriot-Watt University; National University of Ireland, Galway",Heriot-Watt University; St. Abbs Marine Station,F,NBN; Marlin; Marine Environmental Data Network; UK Marine Recorder; Canmore; others,UK,12273 ha,-6000,2014,,F,T,F,,F,F,T,F,F,,T,F,oyster,,F,F,F,T,,T,T,F,F,F,F,F,T,F,NA,,F,F,T,,T,F,F,F,NA,F,F,F,F,F,,description,NA,NA,,T,,F
https://search.proquest.com/docview/2019972726?accountid=14507,53,Global mapping of potential natural vegetation: an assessment of Machine Learning algorithms for estimating land potential,TRUE,"Hengl, T; Walsh, MG; Sanderman, J; Wheeler, I; Harrison, SP; Prentice, IC",PeerJ Preprints,10.7287/peerj.preprints.26811v1 ,2018,,NA,"Envirometrix Tld., Wageningen, the Netherlands",Imperial College London,F,GBIF; EU Forest; BIOME 6000,global,global,unclear,2017,,T,T,T,,F,F,T,F,F,,F,F,trees,,T,T,T,T,,T,F,F,F,F,F,F,F,F,NA,,F,T,F,,T,F,F,F,map accuracy; RMSE; True Positive Rate; AUC; Scaled Shannon Entropy Index; kappa,T,F,F,T,T,,random forest; neural networks; gradient boosting; K-nearest neighbor; cubist,biophysical conditions (160 variables),testing machine learning prediction methods,,T,"worth looking at again, very similar to my project.  Used 160 predictor variables as prediction was main goal.  Perhaps summarise AUC values for individual species predictions and compare to my simulation?",T
https://www.scopus.com/inward/record.uri?eid=2-s2.0-85045056948&doi=10.1007%2fs10841-018-0052-1&partnerID=40&md5=5173c71df4164829d9018143c5c3adfc,60,A role for artificial night-time lighting in long-term changes in populations of 100 widespread macro-moths in UK and Ireland: a citizen-science study,TRUE,"Wilson, JF; Baker, D; Cheney, J; Cook, M; Ellis, M; Freestone, R; Gardner, D; Geen, G; Hemming, R; Hodgers, D; Howarth, S; Jupp, A; Lowe, N; Orridge, S; Shaw, M; Smith, B; Turner, A; Young, H",JOURNAL OF INSECT CONSERVATION,10.1007/s10841-018-0052-1,2018,,Lepidoptera; abundance; light pollution; land-use; northern range boundary,UK and Ireland Garden Moth Scheme,UK and Ireland Garden Moth Scheme,T,UK and Ireland Garden Moth Scheme,UK; Ireland,UK and Ireland excluding Channel Islands,2005,2013,,F,T,F,,F,F,T,T,F,,F,F,moths,,T,T,T,F,,F,T,T,F,F,F,F,F,T,100 m^2,,T,F,F,,T,F,F,F,NA,F,F,T,F,F,,"chi square, linear regression; GLM",larval food plant; over-wintering stage,NA,,T,,T
https://www.scopus.com/inward/record.uri?eid=2-s2.0-85030456712&doi=10.1111%2fecog.03140&partnerID=40&md5=77f06550c18b9822d7961ff92a43f479,69,The spatial distribution and environmental triggers of ant mating flights: using citizen-science data to reveal national patterns,TRUE,"Hart, AG; Hesselberg, T; Nesbit, R; Goodenough, AE",Ecography,10.1111/ecog.03140,2018,,NA,University of Gloucestershire,University of Gloucestershire,T,Royal Society of Biology,UK excluding Northern Ireland,UK excluding Northern Ireland,2012,2014,,F,T,F,,F,F,F,F,T,,F,F,ants,,T,F,F,F,,T,F,T,T,F,F,F,T,F,NA,,T,F,F,,T,F,F,F,NA,F,F,T,F,F,,chi square; GLMM; bootstrap sign test,temperature; wind speed; barometric pressure; trend in those variables (difference from the previous day),NA,,T,,T
10.1371/journal.pone.0191021,96,Changes in the geographical distribution of plant species and climatic variables on the West Cornwall peninsula (South West UK),TRUE,"Kosanic, A; Anderson, K; Harrison, S; Turkington, T; Bennie, J",PloS ONE,10.1371/journal.pone.0191021,2018,,NA,University of Exeter; University of Konstanz,University of Exeter,F,NBN; The Flora of Cornwall (Davey 1909),UK,West Cornwall,1700,2013,,T,T,F,,F,F,T,F,F,,T,F,plants,,F,F,F,T,,T,F,F,F,F,F,F,F,T,10 km^2,,T,F,F,,T,F,F,F,NA,F,F,F,F,F,,Mann-Whitney U test; GLM,Ellenberg values; temperature; precipitation,georeferencing specimens and old records,,T,,T
https://search.proquest.com/docview/1980862738?accountid=14507,103,The interplay of climate and land use change affects the distribution of EU bumblebees,TRUE,"Marshall, L; Biesmeijer, JC; Rasmont, P; Vereecken, NJ; Dvorak, L; Fitzpatrick, U; Francis, F; Neumayer, J; Odegaard, F; Paukkunen, JPT; Pawlikowski, T; Reemer, M; Roberts, SPM; Straka, J; Vray, S; Dendoncker, N",Global Change Biology,10.1111/gcb.13867,2018,,biodiversity loss; dynamic; future; land use change scenarios; pollinators; projections; species distribution models (SDMs); wild bees,"University of Namur; Naturalis Biodiversity Center, Leiden, The Netherlands",University of Namur,T,Atlas Hymenoptera,Norway; Sweden; Finland; Estonia; Latvia; Lithuania; Denmark; UK; Ireland; Netherlands; Belgium; Germany; Poland; Czech Republic; Slovakia; Luxembourg; Hungary; Austria; Slovenia; Switzerland; France; Italy; Portugal; Spain; Greece,"EU without Ireland, Romania, Bulgaria, Canary Islands, and Cyprus, and including Norway and Switzerland",1970,2000,,F,T,F,,F,F,T,F,F,,T,F,Bombus,,F,F,F,T,,T,F,F,F,F,F,F,F,T,1 km^2,,T,T,F,,T,F,F,T,AUC,F,F,F,T,F,,GLM; GBM; Maxent; ensemble,growing degree days; annual water balance precipitation of wettest month; mean diurnal range; annual temperature range; CORINE land use classes,NA,,T,Advocates using land use / cover for predictive SDMs in addition to climate variables.  I plan to do this for all the reasons they say.  ,T
"http://www.mayococo.ie/en/media/Media,30002,en.pdf",124,Ballinrobe Biodiversity Management Plan. Report prepared for Mayo County Council,TRUE,"Smith, GF; D’Arcy, D",Blackthorn Ecology,NA,2018,,NA,Blackthorn Ecology,Blackthorn Ecology,F,NBDC; NPWS; BirdWatch Ireland; Swift Conservation Ireland; Bat Conservation Ireland,Ireland,291 ha,not clear,not clear,,F,T,F,,F,F,F,F,F,,F,F,all,,F,F,F,T,,T,F,F,F,F,F,F,F,T,unclear,,F,F,T,,T,T,T,F,NA,F,F,F,F,F,,description,NA,NA,,T,,F
https://www.sciencedirect.com/science/article/pii/S1470160X18303443,125,Prior specification in Bayesian occupancy modelling improves analysis of species occurrence data,TRUE,"Outhwaite, CL; Chandler, RE; Powney, GD; Collen, B; Gregory, RD; Isaac, NJB",Ecological Indicators,10.1016/jecolind.2018.05.010,2018,,biodiversity indicator; Bayesian occupancy model; multi-species indicator; priors; species occurrence; biological records; biodiversity targets,Centre for Ecology & Hydrology; University College London; RSPB Centre for Conservation Science,Centre for Ecology & Hydrology; University College London,T,"Bees, Wasps and Ants Recording Society",UK; Ireland,UK,1970,2013,,T,T,F,,F,F,T,F,F,,T,F,ants,,F,F,F,F,,T,F,F,F,F,F,F,F,T,1 km^2,,T,F,F,,T,F,F,T,NA,F,T,F,F,F,,occupancy model,time,occpupancy model improvement,,T,wg needs to read,T
NA,131,British phenological records indicate high diversity and extinction rates among late-summer-flying pollinators,TRUE,"Balfour, NJ; Ollerton, J; Castellanos, MC; Ratnieks, FLW",Biological Conservation,10.1016/j.biocon.2018.04.028,2018,,endangered species; extinctions; flowers; flower visitors; foraging resources; phenology; pollinators; seasonality,University of Sussex,University of Sussex,F,"Bees, Wasps and Ants Recording Society; UKBMS; Hoverfly Recording Scheme; GBIF",UK; Ireland; Sweden; Germany; Netherlands; Norway; Belgium; Czech Republic; Luxembourg; France; Austria; Poland; Aoland Islands; Denmark; Finland,UK; Ireland; Sweden; Germany; Netherlands; Norway; Belgium; Czech Republic; Luxembourg; France; Austria; Poland; Aoland Islands; Denmark; Finland,1740,2015,,F,T,T,,T,F,T,F,T,,F,F,Hymenoptera; plants; hoverflies,,T,T,T,T,,T,F,F,F,F,F,F,F,T,10 km^2,,T,F,F,,T,F,F,F,NA,F,F,F,F,F,,Chi-squared; description,extinct status; endangered status,NA,,T,Neat study.  WG read in detail at some point.,T
https://onlinelibrary.wiley.com/doi/abs/10.1111/geb.12742,137,Ocean current connectivity propelling the secondary spread of a marine invasive comb jelly across western Eurasia,TRUE,"Jaspers, C; Huwer, B; Antajan, E; Hosia, A; Hinrichsen, HH; Biastoch, A; Angel, D; Asmus, R; Augustin, C; Bagheri, S; Beggs, SE; Balsby, TJS; Boersma, M; Bonnet, D; Christensen, JT; Danhards, A; Delpy, F; Falkenhaug, T; Finenko, G; Fleming, NEC; Fuentes, V; Galil, B; Gittenberger, A; Griffin, DC; Haslob, H; Javidpour, J; Kamburska, L; Kube, S; Langenberg, VT; Lehtiniemi, M; Lombard, F; Malzahn, A; Marambio, M; Mihneva, V; Moller, LF; Niermann, U; Okyar, MI; Ozdemir, ZB; Pitois, S; Reusch, TBH; Robbens, J; Stefanova, K; Thibault, D; van der Veer, HW; Vansteenbrugge, L; van Walraven, L; Wozniczka, A",Global Ecology and Biogeography,10.1111/geb.12742,2018,,biological invasions; gelatinous zooplankton; invasion corridors; invasive species; jellyfish; marine connectivity; Mnemiopsis leidyi; range expansion; source populations; source-sink dynamics,Technical University of Denmark; Hemholtz Centre for Ocean Research,"National Marine Fisheries Research Institute, Gdynia, Poland",T,many; authors; publications,many,"Western Eurasia; 30 deg N to 66 deg N, 12 deg W to 55 deg east",1982,2016,,F,T,F,,F,F,T,F,F,,T,T,comb jelly; Mnemiopsis leidyi,,T,T,T,T,,T,F,F,F,F,F,F,F,F,NA,,T,F,F,,T,F,F,T,NA,F,F,T,F,F,,GLM; maps,water temperature,NA,,T,,T
https://search.proquest.com/docview/2010299601?accountid=14507,146,Population variability in species can be deduced from opportunistic citizen science records: a case study using British butterflies,TRUE,"Mason, SC; Hill, JK; Thomas, CD; Powney, GD; Fox, R; Brereton, T; Oliver, TH",Insect Conservation and Diversity,10.1111/icad.12242,2018,,abundance; biogeography; biological records; inter-annual variation; population size; range extent,"Centre for Ecology and Hydrology, Wallingford, UK; University of York",University of Reading,T,Butterfly Conservation,UK,30280 km^2,1976,2012,,F,T,T,,F,F,F,T,F,,T,F,butterflies,,T,T,T,F,,T,T,F,F,F,F,F,F,T,10 km^2; 1 km^2,,T,F,F,,T,T,F,F,NA,F,F,T,F,F,,regression; phylogenetic regression,fractal dimension of range; dispersal ability,NA,,T,could be stuff here for me to try with NBDC data,T
https://www.scopus.com/inward/record.uri?eid=2-s2.0-85043761935&doi=10.13156%2farac.2017.17.7.331&partnerID=40&md5=692eb0b62ac9ffafe25146d93e9e61b0,158,Spatiotemporal Variation in House Spider Phenology at a National Scale Using Citizen Science,TRUE,"Hart, AG; Nesbit, R; Goodenough, AE",Arachnology,10.13156/arac.2017.17.7.331,2018,,,,,,,,,,,,,,,,,,,,,,,,,,,,,,,,,,,,,,,,,,,,,,,,,,,,,,,,,,,,,,,
https://www.researchgate.net/profile/Jolyon_Medlock/publication/322922070_Surveillance_of_British_ticks_An_overview_of_species_records_host_associations_and_new_records_of_Ixodes_ricinus_distribution/links/5a9ea06d0f7e9b80dfb4e6cf/Surveillance-of-British-ticks-An-overview-of-species-records-host-associations-and-new-records-of-Ixodes-ricinus-distribution.pdf,176,Ticks and Tick-borne Diseases,TRUE,NA,NA,NA,2018,,,,,,,,,,,,,,,,,,,,,,,,,,,,,,,,,,,,,,,,,,,,,,,,,,,,,,,,,,,,,,,
https://esajournals.onlinelibrary.wiley.com/doi/abs/10.1002/ecy.2237,191,Explaining European fungal fruiting phenology with climate variability,TRUE,NA,NA,NA,2018,,,,,,,,,,,,,,,,,,,,,,,,,,,,,,,,,,,,,,,,,,,,,,,,,,,,,,,,,,,,,,,
https://www.scopus.com/inward/record.uri?eid=2-s2.0-85046708707&doi=10.1007%2fs10530-018-1759-3&partnerID=40&md5=827e3652e4bfb5b9dd341806998e7e6b,197,Working with gardeners to identify potential invasive ornamental garden plants: testing a citizen science approach,TRUE,"Dehnen-Schmutz, K; Conroy, J",Biological Invasions,10.1007/s10530-018-1759-3,2018,,,,,,,,,,,,,,,,,,,,,,,,,,,,,,,,,,,,,,,,,,,,,,,,,,,,,,,,,,,,,,,
https://www.sciencedirect.com/science/article/pii/S1617138117304028,212,Monitoring landscape-scale environmental changes with citizen scientists: twenty years of land use change in Great Britain,TRUE,NA,NA,NA,2018,,,,,,,,,,,,,,,,,,,,,,,,,,,,,,,,,,,,,,,,,,,,,,,,,,,,,,,,,,,,,,,
http://kildare.ie/CountyCouncil/PublicConsultations-Part8Schemes/Housing/P8201803NancysLaneBallinagappaRoadClane/9.%20Ecological%20Impact%20Assessment.pdf,229,Ecological Impact Assessment Proposed residential development at Nancy’s Lane,TRUE,NA,NA,NA,2018,,,,,,,,,,,,,,,,,,,,,,,,,,,,,,,,,,,,,,,,,,,,,,,,,,,,,,,,,,,,,,,
https://search.proquest.com/docview/2032682998?accountid=14507,234,Predicting population trends using citizen science data: do subsampling methods produce reliable estimates for mammals?,TRUE,"Callcutt, K; Croft, S; Smith, GC",NA,NA,2018,,,,,,,,,,,,,,,,,,,,,,,,,,,,,,,,,,,,,,,,,,,,,,,,,,,,,,,,,,,,,,,
https://onlinelibrary.wiley.com/doi/abs/10.1111/ddi.12741,247,"Predicting distributions, habitat preferences and associated conservation implications for a genus of rare fishes, seahorses (Hippocampus spp.)",TRUE,NA,NA,NA,2018,,,,,,,,,,,,,,,,,,,,,,,,,,,,,,,,,,,,,,,,,,,,,,,,,,,,,,,,,,,,,,,
https://search.proquest.com/docview/2045779882?accountid=14507,261,Unlocking biodiversity data: Prioritization and filling the gaps in biodiversity observation data in Europe,TRUE,"Wetzel, FT; Christoph L. HÃ¤user; Martin, CS; Schmeller, DS; Saarenmaa, H; Bingham, HC; Tonkin, JD; Penev, L; Kuhlmann, M; Haase, P; Groom, Q; Stoll, S; Robertson, T; KÃµljalg, U",NA,NA,2018,,,,,,,,,,,,,,,,,,,,,,,,,,,,,,,,,,,,,,,,,,,,,,,,,,,,,,,,,,,,,,,
https://www.scopus.com/inward/record.uri?eid=2-s2.0-85040781887&doi=10.1002%2fecm.1284&partnerID=40&md5=347888ff53790f1a39928c02cae17ccf,274,Upscaling biodiversity: estimating the species–area relationship from small samples,TRUE,"Kunin, WE; Harte, J; He, F; Hui, C; Jobe, RT; Ostling, A; Polce, C; Šizling, A; Smith, AB; Smith, K; Smart, SM; Storch, D; Tjørve, E; Ugland, K-I; Ulrich, W; Varma, V",Ecological Monographs,10.1002/ecm.1284,2018,,,,,,,,,,,,,,,,,,,,,,,,,,,,,,,,,,,,,,,,,,,,,,,,,,,,,,,,,,,,,,,
https://onlinelibrary.wiley.com/doi/abs/10.1111/een.12485,297,Nature protection areas of Europe are insufficient to preserve the threatened beetle Rosalia alpina (Coleoptera: Cerambycidae): evidence from species distribution …,TRUE,NA,NA,NA,2018,,,,,,,,,,,,,,,,,,,,,,,,,,,,,,,,,,,,,,,,,,,,,,,,,,,,,,,,,,,,,,,
https://www.scopus.com/inward/record.uri?eid=2-s2.0-85035785719&doi=10.1016%2fj.funeco.2017.11.009&partnerID=40&md5=064a94ad891cc2fd55c662b7a7903863,298,Congruency in fungal phenology patterns across dataset sources and scales,TRUE,"Andrew, C; Heegaard, E; Gange, AC; Senn-Irlet, B; Egli, S; Kirk, PM; Buntgen, U; Kauserud, H; Boddy, L",FUNGAL ECOLOGY,10.1016/j.funeco.2017.11.009,2018,,,,,,,,,,,,,,,,,,,,,,,,,,,,,,,,,,,,,,,,,,,,,,,,,,,,,,,,,,,,,,,
NA,308,N81 Tullow Footbridges Scheme & Associated Road Reconfiguration Works,TRUE,Atkins Ireland,NA,NA,2018,,,,,,,,,,,,,,,,,,,,,,,,,,,,,,,,,,,,,,,,,,,,,,,,,,,,,,,,,,,,,,,
